{
  "$schema": "https://json-schema.org/draft/2020-12/schema",
  "$id": "https://leyline.dev/schema/1.0.0/leyline-workflow.json",
  "title": "Leyline workflow document",
  "x-leyline-version": "1.0.0",
  "$ref": "#/$defs/LeylineWorkflowDocument",
  "$defs": {
    "LeylineWorkflowDocument": {
      "type": "object",
      "properties": {
        "leylineVersion": {
          "type": "string",
          "pattern": "^(1)\\.(0|[1-9]\\d*)\\.(0|[1-9]\\d*)$"
        },
        "id": {
          "$ref": "#/$defs/LeylineIdentifier"
        },
        "name": {
          "type": "string",
          "minLength": 1
        },
        "description": {
          "type": "string"
        },
        "entry": {
          "$ref": "#/$defs/LeylineIdentifier"
        },
        "context": {
          "$ref": "#/$defs/LeylineContextShape"
        },
        "requires": {
          "$ref": "#/$defs/LeylineRequirements"
        },
        "nodes": {
          "minItems": 1,
          "type": "array",
          "items": {
            "$ref": "#/$defs/LeylineNode"
          }
        }
      },
      "required": [
        "leylineVersion",
        "id",
        "name",
        "entry",
        "nodes"
      ],
      "additionalProperties": {},
      "title": "Leyline workflow document",
      "description": "The canonical, serializable description of a workflow: sequencing, eligibility, navigation, and semantic UI intent."
    },
    "LeylineIdentifier": {
      "type": "string",
      "pattern": "^[A-Za-z0-9][A-Za-z0-9_-]{0,63}$",
      "title": "Identifier",
      "description": "An opaque, stable identifier. Author-supplied names or system-derived content hashes; never a path, URL, or expression."
    },
    "LeylineContextShape": {
      "type": "object",
      "propertyNames": {
        "$ref": "#/$defs/LeylineIdentifier"
      },
      "additionalProperties": {
        "$ref": "#/$defs/LeylineContextField"
      },
      "title": "Context shape",
      "description": "The typed data a workflow instance carries, keyed by field name."
    },
    "LeylineContextField": {
      "type": "object",
      "properties": {
        "type": {
          "type": "string",
          "enum": [
            "string",
            "number",
            "boolean",
            "object",
            "array",
            "unknown"
          ]
        },
        "optional": {
          "type": "boolean"
        },
        "description": {
          "type": "string"
        }
      },
      "required": [
        "type"
      ],
      "additionalProperties": false,
      "title": "Context field"
    },
    "LeylineRequirements": {
      "type": "object",
      "properties": {
        "guards": {
          "type": "array",
          "items": {
            "$ref": "#/$defs/LeylineCapabilityName"
          }
        },
        "services": {
          "type": "array",
          "items": {
            "$ref": "#/$defs/LeylineCapabilityName"
          }
        },
        "dataSources": {
          "type": "array",
          "items": {
            "$ref": "#/$defs/LeylineCapabilityName"
          }
        }
      },
      "additionalProperties": {},
      "title": "Requirements block",
      "description": "Every capability name this document may reference. Binding verifies the set."
    },
    "LeylineCapabilityName": {
      "title": "Capability name",
      "description": "The name of a guard, service, or data source. Implementations bind separately through a capability bundle; a document can never carry one.",
      "$ref": "#/$defs/LeylineIdentifier"
    },
    "LeylineNode": {
      "type": "object",
      "properties": {
        "id": {
          "$ref": "#/$defs/LeylineIdentifier"
        },
        "kind": {
          "type": "string",
          "minLength": 1
        },
        "description": {
          "type": "string"
        },
        "surfaces": {
          "type": "array",
          "items": {
            "$ref": "#/$defs/LeylineSurface"
          }
        },
        "children": {
          "type": "array",
          "items": {
            "$ref": "#/$defs/LeylineIdentifier"
          }
        },
        "mode": {
          "type": "string",
          "enum": [
            "one",
            "many"
          ]
        },
        "initial": {
          "$ref": "#/$defs/LeylineIdentifier"
        },
        "invoke": {
          "$ref": "#/$defs/LeylineInvoke"
        },
        "on": {
          "type": "array",
          "items": {
            "$ref": "#/$defs/LeylineEventTransition"
          }
        }
      },
      "required": [
        "id",
        "kind"
      ],
      "additionalProperties": {},
      "title": "Node",
      "description": "A position in the workflow graph, with the surfaces it presents."
    },
    "LeylineSurface": {
      "type": "object",
      "properties": {
        "id": {
          "$ref": "#/$defs/LeylineIdentifier"
        },
        "type": {
          "type": "string",
          "minLength": 1
        },
        "description": {
          "type": "string"
        },
        "when": {
          "$ref": "#/$defs/LeylineCapabilityName"
        },
        "dataSource": {
          "$ref": "#/$defs/LeylineCapabilityName"
        },
        "target": {
          "$ref": "#/$defs/LeylineIdentifier"
        },
        "props": {
          "$ref": "#/$defs/LeylineProps"
        }
      },
      "required": [
        "type"
      ],
      "additionalProperties": {},
      "title": "Surface",
      "description": "Semantic UI intent attached to a node, resolved to a component by a registry."
    },
    "LeylineProps": {
      "type": "object",
      "propertyNames": {
        "$ref": "#/$defs/LeylineIdentifier"
      },
      "additionalProperties": {
        "$ref": "#/$defs/LeylineJsonValue"
      },
      "title": "Renderer props"
    },
    "LeylineJsonValue": {
      "title": "JSON value",
      "description": "Arbitrary serializable data, treated as inert by every consumer (I4).",
      "$ref": "#/$defs/__schema0"
    },
    "__schema0": {
      "anyOf": [
        {
          "type": "string"
        },
        {
          "type": "number"
        },
        {
          "type": "boolean"
        },
        {
          "type": "null"
        },
        {
          "type": "array",
          "items": {
            "$ref": "#/$defs/__schema0"
          }
        },
        {
          "type": "object",
          "propertyNames": {
            "type": "string"
          },
          "additionalProperties": {
            "$ref": "#/$defs/__schema0"
          }
        }
      ]
    },
    "LeylineInvoke": {
      "type": "object",
      "properties": {
        "service": {
          "$ref": "#/$defs/LeylineCapabilityName"
        },
        "input": {
          "$ref": "#/$defs/LeylineProps"
        },
        "assignTo": {
          "$ref": "#/$defs/LeylineIdentifier"
        },
        "onDone": {
          "type": "array",
          "items": {
            "$ref": "#/$defs/LeylineTransition"
          }
        },
        "onError": {
          "type": "array",
          "items": {
            "$ref": "#/$defs/LeylineTransition"
          }
        }
      },
      "required": [
        "service"
      ],
      "additionalProperties": {},
      "title": "Service invocation"
    },
    "LeylineTransition": {
      "type": "object",
      "properties": {
        "id": {
          "$ref": "#/$defs/LeylineIdentifier"
        },
        "target": {
          "$ref": "#/$defs/LeylineIdentifier"
        },
        "when": {
          "$ref": "#/$defs/LeylineCapabilityName"
        },
        "description": {
          "type": "string"
        }
      },
      "required": [
        "target"
      ],
      "additionalProperties": {},
      "title": "Transition"
    },
    "LeylineEventTransition": {
      "type": "object",
      "properties": {
        "id": {
          "$ref": "#/$defs/LeylineIdentifier"
        },
        "target": {
          "$ref": "#/$defs/LeylineIdentifier"
        },
        "when": {
          "$ref": "#/$defs/LeylineCapabilityName"
        },
        "description": {
          "type": "string"
        },
        "on": {
          "$ref": "#/$defs/LeylineEventName"
        }
      },
      "required": [
        "target",
        "on"
      ],
      "additionalProperties": {},
      "title": "Event transition"
    },
    "LeylineEventName": {
      "type": "string",
      "pattern": "^[A-Za-z][A-Za-z0-9_.-]{0,63}$",
      "title": "Event name"
    }
  }
}
